{"capabilities":[{"enforcement":["tools/loom_orchestrator.py","tools/loom_runtime.py","tools/loom_session.py"],"evidence_ids":[],"id":"one-request-routing","kind":"mechanical","limitations":["No current exact-subject typed evidence envelope is active."],"proof_binding":{"evidence_graph_sha256":null,"files":[{"bytes":547869,"path":"tools/loom_orchestrator.py","role":"enforcement","sha256":"11d53bcca56ebdbe2cbc94f769e5069f6dfe8e1cd3513e4adfaec7280ae876bd"},{"bytes":148819,"path":"tools/loom_runtime.py","role":"enforcement","sha256":"b82163cb65e2424ad35ea259abe65e7c732b510ee7e7db4ade74796c5b11ef6a"},{"bytes":90129,"path":"tools/loom_session.py","role":"enforcement","sha256":"ee495eb3c3f7237582fbfc37f5f07ef0eb7a0ac7ab04f070bb08bdd4a4530a4f"},{"bytes":378985,"path":"tools/test_production_orchestrator.py","role":"test","sha256":"9c6352c4bc81ad68f0c6d450f6f3ff01fdf7a5b8f6d8d6e0fb1e52ae00d6e19a"},{"bytes":68727,"path":"tools/test_loom_runtime.py","role":"test","sha256":"489f91e90012bef58a69f42406b2c0162414ecae5c709648c4d897fe0e8407a7"},{"bytes":35592,"path":"tools/test_loom_session.py","role":"test","sha256":"df3896688a9d43a3075325ca6ca47c91d8a13bdb0093098e8f8767c628185d2b"}],"subject_bindings":[]},"required_predicates":["capability:one-request-routing"],"required_subject_kinds":["candidate-source"],"status":"unverified","tests":["tools/test_production_orchestrator.py","tools/test_loom_runtime.py","tools/test_loom_session.py"]},{"enforcement":["tools/loom_runtime.py","tools/loom_survey.py","tools/loom_project_inspection.py"],"evidence_ids":[],"id":"complete-world-fingerprint","kind":"mechanical","limitations":["No current exact-subject typed evidence envelope is active."],"proof_binding":{"evidence_graph_sha256":null,"files":[{"bytes":148819,"path":"tools/loom_runtime.py","role":"enforcement","sha256":"b82163cb65e2424ad35ea259abe65e7c732b510ee7e7db4ade74796c5b11ef6a"},{"bytes":53936,"path":"tools/loom_survey.py","role":"enforcement","sha256":"da7db734d450fdb20bb4859ef82f499386acb6c4dc116b349cf532387ac4a3b9"},{"bytes":41494,"path":"tools/loom_project_inspection.py","role":"enforcement","sha256":"7e3e49f4c1e67d62f7b091e9b89d5901fa49e27841077d6e1a006dd6a65b5153"},{"bytes":68727,"path":"tools/test_loom_runtime.py","role":"test","sha256":"489f91e90012bef58a69f42406b2c0162414ecae5c709648c4d897fe0e8407a7"},{"bytes":15760,"path":"tools/test_workspace_boundaries.py","role":"test","sha256":"d84c15de38c3761bcc61d99d22258da3956d55e74895ba1c40a5efbe494cf68c"}],"subject_bindings":[]},"required_predicates":["capability:complete-world-fingerprint"],"required_subject_kinds":["candidate-source"],"status":"unverified","tests":["tools/test_loom_runtime.py","tools/test_workspace_boundaries.py"]},{"enforcement":["tools/loom_gate.py"],"evidence_ids":[],"id":"plan-before-implementation","kind":"mechanical","limitations":["No current exact-subject typed evidence envelope is active."],"proof_binding":{"evidence_graph_sha256":null,"files":[{"bytes":93386,"path":"tools/loom_gate.py","role":"enforcement","sha256":"78dcef85aa61b19ab72bbc4a288609532431ac4942c851a3fe8a37e1cbeb9fa8"},{"bytes":31890,"path":"tools/test_loom_gate.py","role":"test","sha256":"1cd2c29b8690c2dc24a42f457cf78eac98700939d448cc4ed65ce332b81477a0"}],"subject_bindings":[]},"required_predicates":["capability:plan-before-implementation"],"required_subject_kinds":["candidate-source"],"status":"unverified","tests":["tools/test_loom_gate.py"]},{"enforcement":["tools/loom_orchestrator.py","schemas/plan-contract.schema.json"],"evidence_ids":[],"id":"sealed-plan-contract","kind":"mechanical","limitations":["No current exact-subject typed evidence envelope is active."],"proof_binding":{"evidence_graph_sha256":null,"files":[{"bytes":547869,"path":"tools/loom_orchestrator.py","role":"enforcement","sha256":"11d53bcca56ebdbe2cbc94f769e5069f6dfe8e1cd3513e4adfaec7280ae876bd"},{"bytes":8193,"path":"schemas/plan-contract.schema.json","role":"enforcement","sha256":"7344b1f2efd968cbedbb350b5e619c75d0cb932df03c2e39117ac0b9b1c6fab6"},{"bytes":378985,"path":"tools/test_production_orchestrator.py","role":"test","sha256":"9c6352c4bc81ad68f0c6d450f6f3ff01fdf7a5b8f6d8d6e0fb1e52ae00d6e19a"}],"subject_bindings":[]},"required_predicates":["capability:sealed-plan-contract"],"required_subject_kinds":["candidate-source"],"status":"unverified","tests":["tools/test_production_orchestrator.py"]},{"enforcement":["tools/loom_orchestrator.py","tools/loom_lifecycle.py"],"evidence_ids":[],"id":"loom-executed-repair-verification","kind":"mechanical","limitations":["No current exact-subject typed evidence envelope is active."],"proof_binding":{"evidence_graph_sha256":null,"files":[{"bytes":547869,"path":"tools/loom_orchestrator.py","role":"enforcement","sha256":"11d53bcca56ebdbe2cbc94f769e5069f6dfe8e1cd3513e4adfaec7280ae876bd"},{"bytes":32324,"path":"tools/loom_lifecycle.py","role":"enforcement","sha256":"0cebd18f066b4d2004f9710a9142599f3259dadeb5f3292814ce72a9b54474ae"},{"bytes":378985,"path":"tools/test_production_orchestrator.py","role":"test","sha256":"9c6352c4bc81ad68f0c6d450f6f3ff01fdf7a5b8f6d8d6e0fb1e52ae00d6e19a"}],"subject_bindings":[]},"required_predicates":["capability:loom-executed-repair-verification"],"required_subject_kinds":["candidate-source"],"status":"unverified","tests":["tools/test_production_orchestrator.py"]},{"enforcement":["tools/loom_lint.py"],"evidence_ids":[],"id":"pack-integrity","kind":"mechanical","limitations":["No current exact-subject typed evidence envelope is active."],"proof_binding":{"evidence_graph_sha256":null,"files":[{"bytes":95067,"path":"tools/loom_lint.py","role":"enforcement","sha256":"1098ba3cede36d206698f3e194db9f191814998bf3aebad3deaaafd403b13a4d"},{"bytes":49421,"path":"tools/test_loom_lint.py","role":"test","sha256":"35e0ae4b2bcf4291f54f4078567fc2285a06311540f6b0692934c30360a7895f"}],"subject_bindings":[]},"required_predicates":["capability:pack-integrity"],"required_subject_kinds":["candidate-source"],"status":"unverified","tests":["tools/test_loom_lint.py"]},{"enforcement":["tools/loom_domain.py","tools/loom_runtime.py","tools/loom_lint.py","tools/loom_gate.py"],"evidence_ids":[],"id":"domain-routing-and-discovery-gate","kind":"mechanical","limitations":["No current exact-subject typed evidence envelope is active."],"proof_binding":{"evidence_graph_sha256":null,"files":[{"bytes":42565,"path":"tools/loom_domain.py","role":"enforcement","sha256":"20d853846ee84d48692c4efdfc778872708c8da7ca3424ed6bfc92bfb0be1689"},{"bytes":148819,"path":"tools/loom_runtime.py","role":"enforcement","sha256":"b82163cb65e2424ad35ea259abe65e7c732b510ee7e7db4ade74796c5b11ef6a"},{"bytes":95067,"path":"tools/loom_lint.py","role":"enforcement","sha256":"1098ba3cede36d206698f3e194db9f191814998bf3aebad3deaaafd403b13a4d"},{"bytes":93386,"path":"tools/loom_gate.py","role":"enforcement","sha256":"78dcef85aa61b19ab72bbc4a288609532431ac4942c851a3fe8a37e1cbeb9fa8"},{"bytes":11762,"path":"tools/test_domain_universality.py","role":"test","sha256":"d99e3e29cdb95bf6bd6347b3c08f2d3bef53a6def6eda3a1eecb5064c2242d75"},{"bytes":378985,"path":"tools/test_production_orchestrator.py","role":"test","sha256":"9c6352c4bc81ad68f0c6d450f6f3ff01fdf7a5b8f6d8d6e0fb1e52ae00d6e19a"},{"bytes":49421,"path":"tools/test_loom_lint.py","role":"test","sha256":"35e0ae4b2bcf4291f54f4078567fc2285a06311540f6b0692934c30360a7895f"},{"bytes":31890,"path":"tools/test_loom_gate.py","role":"test","sha256":"1cd2c29b8690c2dc24a42f457cf78eac98700939d448cc4ed65ce332b81477a0"}],"subject_bindings":[]},"required_predicates":["capability:domain-routing-and-discovery-gate"],"required_subject_kinds":["candidate-source"],"status":"unverified","tests":["tools/test_domain_universality.py","tools/test_production_orchestrator.py","tools/test_loom_lint.py","tools/test_loom_gate.py"]},{"enforcement":["tools/loom_domain_bundle.py","tools/loom_domain_evidence.py","tools/loom_domain_invariants.py","schemas/domain-bundle.schema.json"],"evidence_ids":[],"id":"content-bound-unknown-domain-authority","kind":"mechanical","limitations":["No current exact-subject typed evidence envelope is active."],"proof_binding":{"evidence_graph_sha256":null,"files":[{"bytes":6363,"path":"tools/loom_domain_bundle.py","role":"enforcement","sha256":"f28c9801ef202c7f87ea847cd3dc15df6514f15f4b461f63f44a4bc518c3e5d5"},{"bytes":8582,"path":"tools/loom_domain_evidence.py","role":"enforcement","sha256":"ce9163acc7b51c1cf7384c8215802bc1e09848ff57fb67abf07984321ab2c276"},{"bytes":6764,"path":"tools/loom_domain_invariants.py","role":"enforcement","sha256":"7de545d2c9370b1f0379055dd1fd336b1fea00b7a003856ea87fbbceed269c2e"},{"bytes":1099,"path":"schemas/domain-bundle.schema.json","role":"enforcement","sha256":"6659551e0f50efdfe32639c42158bd79aca1b44df254f07ebdeb0c0b48591204"},{"bytes":4209,"path":"tools/test_domain_evidence.py","role":"test","sha256":"2ed2bae9355b99eb9bb27329408932463e2c4065b414720a7f68b935811238c0"},{"bytes":1670,"path":"tools/test_domain_discovery.py","role":"test","sha256":"d9ef37ad4cde28b4319ad88fdba3df65be2836d67892e9d147371366ce4bae9e"}],"subject_bindings":[]},"required_predicates":["capability:content-bound-unknown-domain-authority"],"required_subject_kinds":["candidate-source"],"status":"unverified","tests":["tools/test_domain_evidence.py","tools/test_domain_discovery.py"]},{"enforcement":["tools/loom_domain_freshness.py","tools/loom_lint.py","tools/loom_orchestrator.py"],"evidence_ids":[],"id":"claim-specific-domain-regating","kind":"mechanical","limitations":["No current exact-subject typed evidence envelope is active."],"proof_binding":{"evidence_graph_sha256":null,"files":[{"bytes":1838,"path":"tools/loom_domain_freshness.py","role":"enforcement","sha256":"375c45509ec4b71781b010313af1324c5d054c02694ba6bb734487cb4b3bbe3f"},{"bytes":95067,"path":"tools/loom_lint.py","role":"enforcement","sha256":"1098ba3cede36d206698f3e194db9f191814998bf3aebad3deaaafd403b13a4d"},{"bytes":547869,"path":"tools/loom_orchestrator.py","role":"enforcement","sha256":"11d53bcca56ebdbe2cbc94f7